
No.     Time           Source                Destination           Protocol Length Datatype   S7 Communication Plus Info
     89 0.770958000    172.22.48.16          172.22.49.201         S7COMM-PLUS 1071              Yes                   PDU-Type: [Data] (S7COMM-PLUS first fragment)

Frame 89: 1071 bytes on wire (8568 bits), 1071 bytes captured (8568 bits) on interface 0
Ethernet II, Src: Vmware_7f:14:9a (00:0c:29:7f:14:9a), Dst: Siemens_13:af:6b (00:1b:1b:13:af:6b)
Internet Protocol Version 4, Src: 172.22.48.16 (172.22.48.16), Dst: 172.22.49.201 (172.22.49.201)
Transmission Control Protocol, Src Port: 49674 (49674), Dst Port: 102 (102), Seq: 17531, Ack: 7297, Len: 1017
TPKT, Version: 3, Length: 1017
ISO 8073/X.224 COTP Connection-Oriented Transport Protocol
[2 COTP Segments (1010 bytes): #70(0), #89(1010)]
S7 Communication Plus
    Header, PDU-Type: Data
    Reassembled in: 90
    Data
        Data unknown: 310000054c000019a0000003a23400000000648526829f87...

No.     Time           Source                Destination           Protocol Length Datatype   S7 Communication Plus Info
     90 0.772098000    172.22.48.16          172.22.49.201         S7COMM-PLUS 711    RID,AID,UDInt Yes                   PDU-Type: [Data] (S7COMM-PLUS reassembled) Op: [Request] Function: [GetMultiVariables] Seq=6560

Frame 90: 711 bytes on wire (5688 bits), 711 bytes captured (5688 bits) on interface 0
Ethernet II, Src: Vmware_7f:14:9a (00:0c:29:7f:14:9a), Dst: Siemens_13:af:6b (00:1b:1b:13:af:6b)
Internet Protocol Version 4, Src: 172.22.48.16 (172.22.48.16), Dst: 172.22.49.201 (172.22.49.201)
Transmission Control Protocol, Src Port: 49674 (49674), Dst Port: 102 (102), Seq: 18548, Ack: 7297, Len: 657
TPKT, Version: 3, Length: 657
ISO 8073/X.224 COTP Connection-Oriented Transport Protocol
S7 Communication Plus
    Header, PDU-Type: Data
    [2 S7COMM-PLUS Fragments (1652 bytes): #89(1006), #90(646)]
    Data, Op: Request
        Opcode: Request (0x31)
        Reserved: 0x0000
        Function: GetMultiVariables (0x054c)
        Reserved: 0x0000
        Sequence number: 6560
        Session Id: 0x000003a2
        Unknown 1: 0x34
        Request Set
        Data unknown: 0000
        ObjectQualifier
        Integrity part
    Trailer, PDU-Type: Data

No.     Time           Source                Destination           Protocol Length Datatype   S7 Communication Plus Info
     92 0.801096000    172.22.49.201         172.22.48.16          S7COMM-PLUS 747    Byte,Byte,Byte,Int,Int,Int,Bool,Bool,Bool,Bool,Bool,Bool,Bool,Bool,Bool,Bool,Bool,Bool,Bool,Bool,Bool,Bool,Int,Int,Int,Int,Int,Int,Int,Int,Int,Byte,Byte,Byte,Int,Int,Int,Int,Int,Bool,Int,Int,Bool,Bool,Int,Bool,Bool,Bool,Bool,Bool,Bool,Bool,Bool,Bool,BoolB Yes                   PDU-Type: [Data] Op: [Response] Function: [GetMultiVariables] Seq=6560

Frame 92: 747 bytes on wire (5976 bits), 747 bytes captured (5976 bits) on interface 0
Ethernet II, Src: Siemens_13:af:6b (00:1b:1b:13:af:6b), Dst: Vmware_7f:14:9a (00:0c:29:7f:14:9a)
Internet Protocol Version 4, Src: 172.22.49.201 (172.22.49.201), Dst: 172.22.48.16 (172.22.48.16)
Transmission Control Protocol, Src Port: 102 (102), Dst Port: 49674 (49674), Seq: 7297, Ack: 19205, Len: 693
TPKT, Version: 3, Length: 693
ISO 8073/X.224 COTP Connection-Oriented Transport Protocol
S7 Communication Plus
    Header, PDU-Type: Data
    Data, Op: Response
        Opcode: Response (0x32)
        Reserved: 0x0000
        Function: GetMultiVariables (0x054c)
        Reserved: 0x0000
        Sequence number: 6560
        Unknown 1: 0x34
        Response Set
            Return value: 0x2027000001820013 - Error code: WarningServiceExecutedWithPartialError (19)
                Bitmask 0x000000000000ffff - Error code: WarningServiceExecutedWithPartialError (19)
                Bitmask 0x00000000ffff0000 - OMS line: 386
                Bitmask 0x000000ff00000000 - Error source: 0x00
                Bitmask 0x0000ef0000000000 - Generic error code: 0x00
                Bitmask 0x0000800000000000 - Server error: False
                Bitmask 0x3fff000000000000 - Debug info: 8231
                Bitmask 0x4000000000000000 - Error extension: False
            ValueList
                Item Value [1]: (Byte) = 0x99
                    Item Number: 1
                    Datatype flags: 0x80, Unknown-Flag1
                    Datatype: Byte (0x0a)
                    Value: 0x99
                Item Value [2]: (Byte) = 0x99
                    Item Number: 2
                    Datatype flags: 0x80, Unknown-Flag1
                    Datatype: Byte (0x0a)
                    Value: 0x99
                Item Value [3]: (Byte) = 0x99
                    Item Number: 3
                    Datatype flags: 0x80, Unknown-Flag1
                    Datatype: Byte (0x0a)
                    Value: 0x99
                Item Value [17]: (Int) = 1
                    Item Number: 17
                    Datatype flags: 0x80, Unknown-Flag1
                    Datatype: Int (0x07)
                    Value: 1
                Item Value [19]: (Int) = 2
                    Item Number: 19
                    Datatype flags: 0x80, Unknown-Flag1
                    Datatype: Int (0x07)
                    Value: 2
                Item Value [20]: (Int) = 3
                    Item Number: 20
                    Datatype flags: 0x80, Unknown-Flag1
                    Datatype: Int (0x07)
                    Value: 3
                Item Value [23]: (Bool) = 0x00
                    Item Number: 23
                    Datatype flags: 0x80, Unknown-Flag1
                    Datatype: Bool (0x01)
                    Value: 0x00
                Item Value [24]: (Bool) = 0x01
                    Item Number: 24
                    Datatype flags: 0x80, Unknown-Flag1
                    Datatype: Bool (0x01)
                    Value: 0x01
                Item Value [25]: (Bool) = 0x00
                    Item Number: 25
                    Datatype flags: 0x80, Unknown-Flag1
                    Datatype: Bool (0x01)
                    Value: 0x00
                Item Value [26]: (Bool) = 0x01
                    Item Number: 26
                    Datatype flags: 0x80, Unknown-Flag1
                    Datatype: Bool (0x01)
                    Value: 0x01
                Item Value [27]: (Bool) = 0x00
                    Item Number: 27
                    Datatype flags: 0x80, Unknown-Flag1
                    Datatype: Bool (0x01)
                    Value: 0x00
                Item Value [28]: (Bool) = 0x01
                    Item Number: 28
                    Datatype flags: 0x80, Unknown-Flag1
                    Datatype: Bool (0x01)
                    Value: 0x01
                Item Value [29]: (Bool) = 0x00
                    Item Number: 29
                    Datatype flags: 0x80, Unknown-Flag1
                    Datatype: Bool (0x01)
                    Value: 0x00
                Item Value [30]: (Bool) = 0x01
                    Item Number: 30
                    Datatype flags: 0x80, Unknown-Flag1
                    Datatype: Bool (0x01)
                    Value: 0x01
                Item Value [31]: (Bool) = 0x00
                    Item Number: 31
                    Datatype flags: 0x80, Unknown-Flag1
                    Datatype: Bool (0x01)
                    Value: 0x00
                Item Value [32]: (Bool) = 0x01
                    Item Number: 32
                    Datatype flags: 0x80, Unknown-Flag1
                    Datatype: Bool (0x01)
                    Value: 0x01
                Item Value [33]: (Bool) = 0x00
                    Item Number: 33
                    Datatype flags: 0x80, Unknown-Flag1
                    Datatype: Bool (0x01)
                    Value: 0x00
                Item Value [34]: (Bool) = 0x01
                    Item Number: 34
                    Datatype flags: 0x80, Unknown-Flag1
                    Datatype: Bool (0x01)
                    Value: 0x01
                Item Value [35]: (Bool) = 0x01
                    Item Number: 35
                    Datatype flags: 0x80, Unknown-Flag1
                    Datatype: Bool (0x01)
                    Value: 0x01
                Item Value [36]: (Bool) = 0x00
                    Item Number: 36
                    Datatype flags: 0x80, Unknown-Flag1
                    Datatype: Bool (0x01)
                    Value: 0x00
                Item Value [37]: (Bool) = 0x00
                    Item Number: 37
                    Datatype flags: 0x80, Unknown-Flag1
                    Datatype: Bool (0x01)
                    Value: 0x00
                Item Value [38]: (Bool) = 0x01
                    Item Number: 38
                    Datatype flags: 0x80, Unknown-Flag1
                    Datatype: Bool (0x01)
                    Value: 0x01
                Item Value [39]: (Int) = 7
                    Item Number: 39
                    Datatype flags: 0x80, Unknown-Flag1
                    Datatype: Int (0x07)
                    Value: 7
                Item Value [40]: (Int) = 5
                    Item Number: 40
                    Datatype flags: 0x80, Unknown-Flag1
                    Datatype: Int (0x07)
                    Value: 5
                Item Value [41]: (Int) = 6
                    Item Number: 41
                    Datatype flags: 0x80, Unknown-Flag1
                    Datatype: Int (0x07)
                    Value: 6
                Item Value [42]: (Int) = 4
                    Item Number: 42
                    Datatype flags: 0x80, Unknown-Flag1
                    Datatype: Int (0x07)
                    Value: 4
                Item Value [44]: (Int) = 214
                    Item Number: 44
                    Datatype flags: 0x80, Unknown-Flag1
                    Datatype: Int (0x07)
                    Value: 214
                Item Value [45]: (Int) = 213
                    Item Number: 45
                    Datatype flags: 0x80, Unknown-Flag1
                    Datatype: Int (0x07)
                    Value: 213
                Item Value [46]: (Int) = 212
                    Item Number: 46
                    Datatype flags: 0x80, Unknown-Flag1
                    Datatype: Int (0x07)
                    Value: 212
                Item Value [47]: (Int) = 211
                    Item Number: 47
                    Datatype flags: 0x80, Unknown-Flag1
                    Datatype: Int (0x07)
                    Value: 211
                Item Value [48]: (Int) = 200
                    Item Number: 48
                    Datatype flags: 0x80, Unknown-Flag1
                    Datatype: Int (0x07)
                    Value: 200
                Item Value [49]: (Byte) = 0x12
                    Item Number: 49
                    Datatype flags: 0x80, Unknown-Flag1
                    Datatype: Byte (0x0a)
                    Value: 0x12
                Item Value [50]: (Byte) = 0x10
                    Item Number: 50
                    Datatype flags: 0x80, Unknown-Flag1
                    Datatype: Byte (0x0a)
                    Value: 0x10
                Item Value [51]: (Byte) = 0x11
                    Item Number: 51
                    Datatype flags: 0x80, Unknown-Flag1
                    Datatype: Byte (0x0a)
                    Value: 0x11
                Item Value [67]: (Int) = 206
                    Item Number: 67
                    Datatype flags: 0x80, Unknown-Flag1
                    Datatype: Int (0x07)
                    Value: 206
                Item Value [68]: (Int) = 205
                    Item Number: 68
                    Datatype flags: 0x80, Unknown-Flag1
                    Datatype: Int (0x07)
                    Value: 205
                Item Value [69]: (Int) = 204
                    Item Number: 69
                    Datatype flags: 0x80, Unknown-Flag1
                    Datatype: Int (0x07)
                    Value: 204
                Item Value [70]: (Int) = 203
                    Item Number: 70
                    Datatype flags: 0x80, Unknown-Flag1
                    Datatype: Int (0x07)
                    Value: 203
                Item Value [71]: (Int) = 202
                    Item Number: 71
                    Datatype flags: 0x80, Unknown-Flag1
                    Datatype: Int (0x07)
                    Value: 202
                Item Value [73]: (Bool) = 0x01
                    Item Number: 73
                    Datatype flags: 0x80, Unknown-Flag1
                    Datatype: Bool (0x01)
                    Value: 0x01
                Item Value [74]: (Int) = 229
                    Item Number: 74
                    Datatype flags: 0x80, Unknown-Flag1
                    Datatype: Int (0x07)
                    Value: 229
                Item Value [75]: (Int) = 228
                    Item Number: 75
                    Datatype flags: 0x80, Unknown-Flag1
                    Datatype: Int (0x07)
                    Value: 228
                Item Value [76]: (Bool) = 0x01
                    Item Number: 76
                    Datatype flags: 0x80, Unknown-Flag1
                    Datatype: Bool (0x01)
                    Value: 0x01
                Item Value [77]: (Bool) = 0x01
                    Item Number: 77
                    Datatype flags: 0x80, Unknown-Flag1
                    Datatype: Bool (0x01)
                    Value: 0x01
                Item Value [78]: (Int) = 227
                    Item Number: 78
                    Datatype flags: 0x80, Unknown-Flag1
                    Datatype: Int (0x07)
                    Value: 227
                Item Value [79]: (Bool) = 0x01
                    Item Number: 79
                    Datatype flags: 0x80, Unknown-Flag1
                    Datatype: Bool (0x01)
                    Value: 0x01
                Item Value [80]: (Bool) = 0x01
                    Item Number: 80
                    Datatype flags: 0x80, Unknown-Flag1
                    Datatype: Bool (0x01)
                    Value: 0x01
                Item Value [81]: (Bool) = 0x01
                    Item Number: 81
                    Datatype flags: 0x80, Unknown-Flag1
                    Datatype: Bool (0x01)
                    Value: 0x01
                Item Value [82]: (Bool) = 0x00
                    Item Number: 82
                    Datatype flags: 0x80, Unknown-Flag1
                    Datatype: Bool (0x01)
                    Value: 0x00
                Item Value [83]: (Bool) = 0x00
                    Item Number: 83
                    Datatype flags: 0x80, Unknown-Flag1
                    Datatype: Bool (0x01)
                    Value: 0x00
                Item Value [84]: (Bool) = 0x00
                    Item Number: 84
                    Datatype flags: 0x80, Unknown-Flag1
                    Datatype: Bool (0x01)
                    Value: 0x00
                Item Value [85]: (Bool) = 0x00
                    Item Number: 85
                    Datatype flags: 0x80, Unknown-Flag1
                    Datatype: Bool (0x01)
                    Value: 0x00
                Item Value [86]: (Bool) = 0x01
                    Item Number: 86
                    Datatype flags: 0x80, Unknown-Flag1
                    Datatype: Bool (0x01)
                    Value: 0x01
                Item Value [87]: (Bool) = 0x01
                    Item Number: 87
                    Datatype flags: 0x80, Unknown-Flag1
                    Datatype: Bool (0x01)
                    Value: 0x01
                Item Value [88]: (Bool) = 0x01
                    Item Number: 88
                    Datatype flags: 0x80, Unknown-Flag1
                    Datatype: Bool (0x01)
                    Value: 0x01
                Item Value [89]: (Bool) = 0x01
                    Item Number: 89
                    Datatype flags: 0x80, Unknown-Flag1
                    Datatype: Bool (0x01)
                    Value: 0x01
                Item Value [90]: (Bool) = 0x01
                    Item Number: 90
                    Datatype flags: 0x80, Unknown-Flag1
                    Datatype: Bool (0x01)
                    Value: 0x01
                Item Value [91]: (Bool) = 0x01
                    Item Number: 91
                    Datatype flags: 0x80, Unknown-Flag1
                    Datatype: Bool (0x01)
                    Value: 0x01
                Item Value [92]: (Bool) = 0x00
                    Item Number: 92
                    Datatype flags: 0x80, Unknown-Flag1
                    Datatype: Bool (0x01)
                    Value: 0x00
                Item Value [93]: (Bool) = 0x00
                    Item Number: 93
                    Datatype flags: 0x80, Unknown-Flag1
                    Datatype: Bool (0x01)
                    Value: 0x00
                Item Value [94]: (Bool) = 0x00
                    Item Number: 94
                    Datatype flags: 0x80, Unknown-Flag1
                    Datatype: Bool (0x01)
                    Value: 0x00
                Item Value [95]: (Bool) = 0x00
                    Item Number: 95
                    Datatype flags: 0x80, Unknown-Flag1
                    Datatype: Bool (0x01)
                    Value: 0x00
                Item Value [96]: (Int) = 220
                    Item Number: 96
                    Datatype flags: 0x80, Unknown-Flag1
                    Datatype: Int (0x07)
                    Value: 220
                Item Value [97]: (Int) = 226
                    Item Number: 97
                    Datatype flags: 0x80, Unknown-Flag1
                    Datatype: Int (0x07)
                    Value: 226
                Item Value [98]: (Bool) = 0x01
                    Item Number: 98
                    Datatype flags: 0x80, Unknown-Flag1
                    Datatype: Bool (0x01)
                    Value: 0x01
                Item Value [99]: (Int) = 221
                    Item Number: 99
                    Datatype flags: 0x80, Unknown-Flag1
                    Datatype: Int (0x07)
                    Value: 221
                Item Value [100]: (Int) = 224
                    Item Number: 100
                    Datatype flags: 0x80, Unknown-Flag1
                    Datatype: Int (0x07)
                    Value: 224
                Terminating Item/List
            ErrorValueList
        Integrity part
    Trailer, PDU-Type: Data

No.     Time           Source                Destination           Protocol Length Datatype   S7 Communication Plus Info
     94 0.803720000    172.22.48.16          172.22.49.201         S7COMM-PLUS 1070              Yes                   PDU-Type: [Data] (S7COMM-PLUS first fragment)

Frame 94: 1070 bytes on wire (8560 bits), 1070 bytes captured (8560 bits) on interface 0
Ethernet II, Src: Vmware_7f:14:9a (00:0c:29:7f:14:9a), Dst: Siemens_13:af:6b (00:1b:1b:13:af:6b)
Internet Protocol Version 4, Src: 172.22.48.16 (172.22.48.16), Dst: 172.22.49.201 (172.22.49.201)
Transmission Control Protocol, Src Port: 49674 (49674), Dst Port: 102 (102), Seq: 19212, Ack: 7990, Len: 1016
TPKT, Version: 3, Length: 1016
ISO 8073/X.224 COTP Connection-Oriented Transport Protocol
[2 COTP Segments (1009 bytes): #93(0), #94(1009)]
S7 Communication Plus
    Header, PDU-Type: Data
    Reassembled in: 95
    Data
        Data unknown: 310000054c000019a1000003a2340000000064851a8f8c93...

No.     Time           Source                Destination           Protocol Length Datatype   S7 Communication Plus Info
     95 0.804607000    172.22.48.16          172.22.49.201         S7COMM-PLUS 700    RID,AID,UDInt Yes                   PDU-Type: [Data] (S7COMM-PLUS reassembled) Op: [Request] Function: [GetMultiVariables] Seq=6561

Frame 95: 700 bytes on wire (5600 bits), 700 bytes captured (5600 bits) on interface 0
Ethernet II, Src: Vmware_7f:14:9a (00:0c:29:7f:14:9a), Dst: Siemens_13:af:6b (00:1b:1b:13:af:6b)
Internet Protocol Version 4, Src: 172.22.48.16 (172.22.48.16), Dst: 172.22.49.201 (172.22.49.201)
Transmission Control Protocol, Src Port: 49674 (49674), Dst Port: 102 (102), Seq: 20228, Ack: 7990, Len: 646
TPKT, Version: 3, Length: 646
ISO 8073/X.224 COTP Connection-Oriented Transport Protocol
S7 Communication Plus
    Header, PDU-Type: Data
    [2 S7COMM-PLUS Fragments (1640 bytes): #94(1005), #95(635)]
    Data, Op: Request
        Opcode: Request (0x31)
        Reserved: 0x0000
        Function: GetMultiVariables (0x054c)
        Reserved: 0x0000
        Sequence number: 6561
        Session Id: 0x000003a2
        Unknown 1: 0x34
        Request Set
        Data unknown: 0000
        ObjectQualifier
        Integrity part
    Trailer, PDU-Type: Data

No.     Time           Source                Destination           Protocol Length Datatype   S7 Communication Plus Info
     97 0.836489000    172.22.49.201         172.22.48.16          S7COMM-PLUS 685    Int,Int,Int,Bool,Int,Bool,Bool,Bool,Bool,Bool,Bool,Bool,Bool,Bool,Bool,Bool,Bool,Bool,Bool,Bool,Bool,Int,Int,Int,Int,Int,Bool,Bool,Bool,Bool,Bool,Bool,Bool,Bool,Bool,Bool,Bool,Bool,Bool,Bool,Bool,Bool,Int,Byte,Byte,Byte,Int,Int,Int,Bool,Bool,Bool,Bool,Boo Yes                   PDU-Type: [Data] Op: [Response] Function: [GetMultiVariables] Seq=6561

Frame 97: 685 bytes on wire (5480 bits), 685 bytes captured (5480 bits) on interface 0
Ethernet II, Src: Siemens_13:af:6b (00:1b:1b:13:af:6b), Dst: Vmware_7f:14:9a (00:0c:29:7f:14:9a)
Internet Protocol Version 4, Src: 172.22.49.201 (172.22.49.201), Dst: 172.22.48.16 (172.22.48.16)
Transmission Control Protocol, Src Port: 102 (102), Dst Port: 49674 (49674), Seq: 7990, Ack: 20874, Len: 631
TPKT, Version: 3, Length: 631
ISO 8073/X.224 COTP Connection-Oriented Transport Protocol
S7 Communication Plus
    Header, PDU-Type: Data
    Data, Op: Response
        Opcode: Response (0x32)
        Reserved: 0x0000
        Function: GetMultiVariables (0x054c)
        Reserved: 0x0000
        Sequence number: 6561
        Unknown 1: 0x34
        Response Set
            Return value: 0x2027000001820013 - Error code: WarningServiceExecutedWithPartialError (19)
                Bitmask 0x000000000000ffff - Error code: WarningServiceExecutedWithPartialError (19)
                Bitmask 0x00000000ffff0000 - OMS line: 386
                Bitmask 0x000000ff00000000 - Error source: 0x00
                Bitmask 0x0000ef0000000000 - Generic error code: 0x00
                Bitmask 0x0000800000000000 - Server error: False
                Bitmask 0x3fff000000000000 - Debug info: 8231
                Bitmask 0x4000000000000000 - Error extension: False
            ValueList
                Item Value [1]: (Int) = 222
                    Item Number: 1
                    Datatype flags: 0x80, Unknown-Flag1
                    Datatype: Int (0x07)
                    Value: 222
                Item Value [2]: (Int) = 223
                    Item Number: 2
                    Datatype flags: 0x80, Unknown-Flag1
                    Datatype: Int (0x07)
                    Value: 223
                Item Value [3]: (Int) = 225
                    Item Number: 3
                    Datatype flags: 0x80, Unknown-Flag1
                    Datatype: Int (0x07)
                    Value: 225
                Item Value [4]: (Bool) = 0x01
                    Item Number: 4
                    Datatype flags: 0x80, Unknown-Flag1
                    Datatype: Bool (0x01)
                    Value: 0x01
                Item Value [5]: (Int) = 230
                    Item Number: 5
                    Datatype flags: 0x80, Unknown-Flag1
                    Datatype: Int (0x07)
                    Value: 230
                Item Value [7]: (Bool) = 0x01
                    Item Number: 7
                    Datatype flags: 0x80, Unknown-Flag1
                    Datatype: Bool (0x01)
                    Value: 0x01
                Item Value [8]: (Bool) = 0x01
                    Item Number: 8
                    Datatype flags: 0x80, Unknown-Flag1
                    Datatype: Bool (0x01)
                    Value: 0x01
                Item Value [9]: (Bool) = 0x01
                    Item Number: 9
                    Datatype flags: 0x80, Unknown-Flag1
                    Datatype: Bool (0x01)
                    Value: 0x01
                Item Value [10]: (Bool) = 0x01
                    Item Number: 10
                    Datatype flags: 0x80, Unknown-Flag1
                    Datatype: Bool (0x01)
                    Value: 0x01
                Item Value [11]: (Bool) = 0x00
                    Item Number: 11
                    Datatype flags: 0x80, Unknown-Flag1
                    Datatype: Bool (0x01)
                    Value: 0x00
                Item Value [12]: (Bool) = 0x00
                    Item Number: 12
                    Datatype flags: 0x80, Unknown-Flag1
                    Datatype: Bool (0x01)
                    Value: 0x00
                Item Value [13]: (Bool) = 0x00
                    Item Number: 13
                    Datatype flags: 0x80, Unknown-Flag1
                    Datatype: Bool (0x01)
                    Value: 0x00
                Item Value [14]: (Bool) = 0x00
                    Item Number: 14
                    Datatype flags: 0x80, Unknown-Flag1
                    Datatype: Bool (0x01)
                    Value: 0x00
                Item Value [15]: (Bool) = 0x01
                    Item Number: 15
                    Datatype flags: 0x80, Unknown-Flag1
                    Datatype: Bool (0x01)
                    Value: 0x01
                Item Value [16]: (Bool) = 0x01
                    Item Number: 16
                    Datatype flags: 0x80, Unknown-Flag1
                    Datatype: Bool (0x01)
                    Value: 0x01
                Item Value [17]: (Bool) = 0x00
                    Item Number: 17
                    Datatype flags: 0x80, Unknown-Flag1
                    Datatype: Bool (0x01)
                    Value: 0x00
                Item Value [18]: (Bool) = 0x00
                    Item Number: 18
                    Datatype flags: 0x80, Unknown-Flag1
                    Datatype: Bool (0x01)
                    Value: 0x00
                Item Value [19]: (Bool) = 0x00
                    Item Number: 19
                    Datatype flags: 0x80, Unknown-Flag1
                    Datatype: Bool (0x01)
                    Value: 0x00
                Item Value [20]: (Bool) = 0x00
                    Item Number: 20
                    Datatype flags: 0x80, Unknown-Flag1
                    Datatype: Bool (0x01)
                    Value: 0x00
                Item Value [21]: (Bool) = 0x01
                    Item Number: 21
                    Datatype flags: 0x80, Unknown-Flag1
                    Datatype: Bool (0x01)
                    Value: 0x01
                Item Value [22]: (Bool) = 0x01
                    Item Number: 22
                    Datatype flags: 0x80, Unknown-Flag1
                    Datatype: Bool (0x01)
                    Value: 0x01
                Item Value [23]: (Int) = 210
                    Item Number: 23
                    Datatype flags: 0x80, Unknown-Flag1
                    Datatype: Int (0x07)
                    Value: 210
                Item Value [24]: (Int) = 209
                    Item Number: 24
                    Datatype flags: 0x80, Unknown-Flag1
                    Datatype: Int (0x07)
                    Value: 209
                Item Value [25]: (Int) = 208
                    Item Number: 25
                    Datatype flags: 0x80, Unknown-Flag1
                    Datatype: Int (0x07)
                    Value: 208
                Item Value [26]: (Int) = 207
                    Item Number: 26
                    Datatype flags: 0x80, Unknown-Flag1
                    Datatype: Int (0x07)
                    Value: 207
                Item Value [27]: (Int) = 201
                    Item Number: 27
                    Datatype flags: 0x80, Unknown-Flag1
                    Datatype: Int (0x07)
                    Value: 201
                Item Value [28]: (Bool) = 0x01
                    Item Number: 28
                    Datatype flags: 0x80, Unknown-Flag1
                    Datatype: Bool (0x01)
                    Value: 0x01
                Item Value [29]: (Bool) = 0x01
                    Item Number: 29
                    Datatype flags: 0x80, Unknown-Flag1
                    Datatype: Bool (0x01)
                    Value: 0x01
                Item Value [30]: (Bool) = 0x01
                    Item Number: 30
                    Datatype flags: 0x80, Unknown-Flag1
                    Datatype: Bool (0x01)
                    Value: 0x01
                Item Value [31]: (Bool) = 0x01
                    Item Number: 31
                    Datatype flags: 0x80, Unknown-Flag1
                    Datatype: Bool (0x01)
                    Value: 0x01
                Item Value [32]: (Bool) = 0x01
                    Item Number: 32
                    Datatype flags: 0x80, Unknown-Flag1
                    Datatype: Bool (0x01)
                    Value: 0x01
                Item Value [33]: (Bool) = 0x01
                    Item Number: 33
                    Datatype flags: 0x80, Unknown-Flag1
                    Datatype: Bool (0x01)
                    Value: 0x01
                Item Value [34]: (Bool) = 0x01
                    Item Number: 34
                    Datatype flags: 0x80, Unknown-Flag1
                    Datatype: Bool (0x01)
                    Value: 0x01
                Item Value [35]: (Bool) = 0x01
                    Item Number: 35
                    Datatype flags: 0x80, Unknown-Flag1
                    Datatype: Bool (0x01)
                    Value: 0x01
                Item Value [36]: (Bool) = 0x01
                    Item Number: 36
                    Datatype flags: 0x80, Unknown-Flag1
                    Datatype: Bool (0x01)
                    Value: 0x01
                Item Value [37]: (Bool) = 0x01
                    Item Number: 37
                    Datatype flags: 0x80, Unknown-Flag1
                    Datatype: Bool (0x01)
                    Value: 0x01
                Item Value [38]: (Bool) = 0x01
                    Item Number: 38
                    Datatype flags: 0x80, Unknown-Flag1
                    Datatype: Bool (0x01)
                    Value: 0x01
                Item Value [39]: (Bool) = 0x01
                    Item Number: 39
                    Datatype flags: 0x80, Unknown-Flag1
                    Datatype: Bool (0x01)
                    Value: 0x01
                Item Value [40]: (Bool) = 0x01
                    Item Number: 40
                    Datatype flags: 0x80, Unknown-Flag1
                    Datatype: Bool (0x01)
                    Value: 0x01
                Item Value [41]: (Bool) = 0x01
                    Item Number: 41
                    Datatype flags: 0x80, Unknown-Flag1
                    Datatype: Bool (0x01)
                    Value: 0x01
                Item Value [42]: (Bool) = 0x01
                    Item Number: 42
                    Datatype flags: 0x80, Unknown-Flag1
                    Datatype: Bool (0x01)
                    Value: 0x01
                Item Value [43]: (Bool) = 0x01
                    Item Number: 43
                    Datatype flags: 0x80, Unknown-Flag1
                    Datatype: Bool (0x01)
                    Value: 0x01
                Item Value [45]: (Int) = 215
                    Item Number: 45
                    Datatype flags: 0x80, Unknown-Flag1
                    Datatype: Int (0x07)
                    Value: 215
                Item Value [46]: (Byte) = 0x00
                    Item Number: 46
                    Datatype flags: 0x80, Unknown-Flag1
                    Datatype: Byte (0x0a)
                    Value: 0x00
                Item Value [47]: (Byte) = 0x00
                    Item Number: 47
                    Datatype flags: 0x80, Unknown-Flag1
                    Datatype: Byte (0x0a)
                    Value: 0x00
                Item Value [48]: (Byte) = 0x00
                    Item Number: 48
                    Datatype flags: 0x80, Unknown-Flag1
                    Datatype: Byte (0x0a)
                    Value: 0x00
                Item Value [62]: (Int) = 12
                    Item Number: 62
                    Datatype flags: 0x80, Unknown-Flag1
                    Datatype: Int (0x07)
                    Value: 12
                Item Value [64]: (Int) = 13
                    Item Number: 64
                    Datatype flags: 0x80, Unknown-Flag1
                    Datatype: Int (0x07)
                    Value: 13
                Item Value [65]: (Int) = 14
                    Item Number: 65
                    Datatype flags: 0x80, Unknown-Flag1
                    Datatype: Int (0x07)
                    Value: 14
                Item Value [68]: (Bool) = 0x00
                    Item Number: 68
                    Datatype flags: 0x80, Unknown-Flag1
                    Datatype: Bool (0x01)
                    Value: 0x00
                Item Value [69]: (Bool) = 0x00
                    Item Number: 69
                    Datatype flags: 0x80, Unknown-Flag1
                    Datatype: Bool (0x01)
                    Value: 0x00
                Item Value [70]: (Bool) = 0x00
                    Item Number: 70
                    Datatype flags: 0x80, Unknown-Flag1
                    Datatype: Bool (0x01)
                    Value: 0x00
                Item Value [71]: (Bool) = 0x00
                    Item Number: 71
                    Datatype flags: 0x80, Unknown-Flag1
                    Datatype: Bool (0x01)
                    Value: 0x00
                Item Value [72]: (Bool) = 0x00
                    Item Number: 72
                    Datatype flags: 0x80, Unknown-Flag1
                    Datatype: Bool (0x01)
                    Value: 0x00
                Item Value [73]: (Bool) = 0x00
                    Item Number: 73
                    Datatype flags: 0x80, Unknown-Flag1
                    Datatype: Bool (0x01)
                    Value: 0x00
                Item Value [74]: (Bool) = 0x00
                    Item Number: 74
                    Datatype flags: 0x80, Unknown-Flag1
                    Datatype: Bool (0x01)
                    Value: 0x00
                Item Value [75]: (Bool) = 0x00
                    Item Number: 75
                    Datatype flags: 0x80, Unknown-Flag1
                    Datatype: Bool (0x01)
                    Value: 0x00
                Item Value [76]: (Bool) = 0x00
                    Item Number: 76
                    Datatype flags: 0x80, Unknown-Flag1
                    Datatype: Bool (0x01)
                    Value: 0x00
                Item Value [77]: (Bool) = 0x00
                    Item Number: 77
                    Datatype flags: 0x80, Unknown-Flag1
                    Datatype: Bool (0x01)
                    Value: 0x00
                Item Value [78]: (Bool) = 0x00
                    Item Number: 78
                    Datatype flags: 0x80, Unknown-Flag1
                    Datatype: Bool (0x01)
                    Value: 0x00
                Item Value [79]: (Bool) = 0x00
                    Item Number: 79
                    Datatype flags: 0x80, Unknown-Flag1
                    Datatype: Bool (0x01)
                    Value: 0x00
                Item Value [80]: (Bool) = 0x00
                    Item Number: 80
                    Datatype flags: 0x80, Unknown-Flag1
                    Datatype: Bool (0x01)
                    Value: 0x00
                Item Value [81]: (Bool) = 0x00
                    Item Number: 81
                    Datatype flags: 0x80, Unknown-Flag1
                    Datatype: Bool (0x01)
                    Value: 0x00
                Item Value [82]: (Bool) = 0x00
                    Item Number: 82
                    Datatype flags: 0x80, Unknown-Flag1
                    Datatype: Bool (0x01)
                    Value: 0x00
                Item Value [83]: (Bool) = 0x00
                    Item Number: 83
                    Datatype flags: 0x80, Unknown-Flag1
                    Datatype: Bool (0x01)
                    Value: 0x00
                Item Value [84]: (Int) = 18
                    Item Number: 84
                    Datatype flags: 0x80, Unknown-Flag1
                    Datatype: Int (0x07)
                    Value: 18
                Item Value [85]: (Int) = 16
                    Item Number: 85
                    Datatype flags: 0x80, Unknown-Flag1
                    Datatype: Int (0x07)
                    Value: 16
                Item Value [86]: (Int) = 17
                    Item Number: 86
                    Datatype flags: 0x80, Unknown-Flag1
                    Datatype: Int (0x07)
                    Value: 17
                Item Value [87]: (Int) = 15
                    Item Number: 87
                    Datatype flags: 0x80, Unknown-Flag1
                    Datatype: Int (0x07)
                    Value: 15
                Item Value [89]: (Int) = 0
                    Item Number: 89
                    Datatype flags: 0x80, Unknown-Flag1
                    Datatype: Int (0x07)
                    Value: 0
                Item Value [90]: (Int) = 0
                    Item Number: 90
                    Datatype flags: 0x80, Unknown-Flag1
                    Datatype: Int (0x07)
                    Value: 0
                Item Value [91]: (Int) = 0
                    Item Number: 91
                    Datatype flags: 0x80, Unknown-Flag1
                    Datatype: Int (0x07)
                    Value: 0
                Item Value [92]: (Int) = 0
                    Item Number: 92
                    Datatype flags: 0x80, Unknown-Flag1
                    Datatype: Int (0x07)
                    Value: 0
                Item Value [93]: (Int) = 0
                    Item Number: 93
                    Datatype flags: 0x80, Unknown-Flag1
                    Datatype: Int (0x07)
                    Value: 0
                Item Value [94]: (Byte) = 0x00
                    Item Number: 94
                    Datatype flags: 0x80, Unknown-Flag1
                    Datatype: Byte (0x0a)
                    Value: 0x00
                Item Value [95]: (Byte) = 0x00
                    Item Number: 95
                    Datatype flags: 0x80, Unknown-Flag1
                    Datatype: Byte (0x0a)
                    Value: 0x00
                Item Value [96]: (Byte) = 0x00
                    Item Number: 96
                    Datatype flags: 0x80, Unknown-Flag1
                    Datatype: Byte (0x0a)
                    Value: 0x00
                Terminating Item/List
            ErrorValueList
        Integrity part
    Trailer, PDU-Type: Data

